user_input,reference_contexts,reference,synthesizer_name
Coud you explain how the weather patterns in Bolivia are influenced by the phenomena of curving cloud streets?,"['To the human eye, the wind is invisible. It can only be visualized by proxy, by its expressions in other phenomena like blowing leaves,\n\nairborne dust, white-capped waters—or the patterns of clouds.\n\nAcquired in June 2014 by the Aqua satellite, this image shows a broad swath of the Amazon rainforest in Brazil and Bolivia as it\n\nappeared in the early afternoon. As sunlight warms the forest in the morning, water vapor rises on columns of heated air. When that\n\nhumid air runs into a cooler, more stable air mass above, it condenses into fluffy cumulus clouds.\n\nCumulus cloud streets often trace the direction, and sometimes the intensity, of winds—lining up parallel to the direction of the wind.\n\nUsually this means a straight line, but clouds can also line up along the concentric, curved lines of high-pressure weather systems,\n\nas they did here.\n\nE R E H P S O M T A\n\n4']","In Bolivia, weather patterns are influenced by curving cloud streets that form when humid air rises and encounters cooler, more stable air masses. This process leads to the condensation of water vapor into fluffy cumulus clouds, which can align along the direction of the wind or along the concentric, curved lines of high-pressure weather systems.",single_hop_specifc_query_synthesizer
How do air masses from Africa influence cloud formation off the coast of Mauritania?,"['You cannot see it directly, but air masses from Africa and the Atlantic Ocean are colliding in this Landsat 8 image from August 2016.\n\nThe collision off the coast of Mauritania produces a wave structure in the atmosphere.\n\nCalled an undular bore or solitary wave, this cloud formation was created by the interaction between cool, dry air coming off the\n\ncontinent and running into warm, moist air over the ocean. The winds blowing out from the land push a wave of air ahead like a\n\nbow wave moving ahead of a boat.\n\nParts of these waves are favorable for cloud formation, while other parts are not. The dust blowing out from Africa appears to be\n\nriding these waves. Dust has been known to affect cloud growth, but it probably has little to do with the cloud pattern observed here.\n\nE R E H P S O M T A\n\n16']","Air masses from Africa and the Atlantic Ocean collide off the coast of Mauritania, creating a wave structure in the atmosphere known as an undular bore or solitary wave. This formation occurs due to the interaction between cool, dry air from the continent and warm, moist air over the ocean. The winds from the land push a wave of air ahead, which can create conditions favorable for cloud formation in some parts, while other parts may not support cloud growth. Additionally, dust blowing out from Africa interacts with these waves, although it likely has little impact on the specific cloud pattern observed.",single_hop_specifc_query_synthesizer
Wht are the cloud behaviors observed in the valleys of Peru that empty into the Pacifc Ocan?,"['The valleys along Peru’s southern coast are among the deepest on Earth. They are also frequently filled with clouds. In July 2015,\n\nLandsat 8 captured this view of the cloud-filled canyons through which the Yauca and Acarí rivers empty into the Pacific Ocean.\n\nYou can’t see it, but the Pacific lies below the clouds on the lower left. The clouds are marine stratocumulus—a type of low-level\n\ncloud so close to the surface that it is essentially fog. Such clouds are a persistent feature off the coast of Peru and Chile,\n\ndeveloping most often during the winter and early spring. On some occasions, prevailing winds can push the clouds inland.\n\nBecause the marine clouds are low, they are easily blocked by coastal mountains and hills, such as the Andes. But in areas where\n\nlow valleys open to the ocean, the clouds move inland.\n\nE R E H P S O M T A\n\n8']","The valleys along Peru’s southern coast are frequently filled with clouds, particularly marine stratocumulus clouds, which are low-level clouds that can appear similar to fog. These clouds are a persistent feature off the coast of Peru and Chile, developing most often during the winter and early spring. When prevailing winds push the clouds inland, they can fill the low valleys that open to the Pacific Ocean.",single_hop_specifc_query_synthesizer
What happen in Bering Strait in January 2010?,"['Winds from the northeast pushed sea ice southward and formed cloud streets—parallel rows of clouds—over the Bering Strait in\n\nJanuary 2010. The easternmost reaches of Russia, blanketed in snow and ice, appear in the upper left. To the east, sea ice spans\n\nthe Bering Strait. Along the southern edge of the ice, wavy tendrils of newly formed, thin sea ice predominate.\n\nThe cloud streets run in the direction of the northerly wind that helps form them. When wind blows out from a cold surface like sea\n\nice over the warmer, moister air near the open ocean, cylinders of spinning air may develop. Clouds form along the upward cycle in\n\nthe cylinders, where air is rising, and skies remain clear along the downward cycle, where air is falling. The cloud streets run toward\n\nthe southwest in this image from the Terra satellite.\n\nE R E H P S O M T A\n\n14']","In January 2010, winds from the northeast pushed sea ice southward and formed cloud streets—parallel rows of clouds—over the Bering Strait.",single_hop_specifc_query_synthesizer
Can you elaborate on the characteristics and significance of Herbert Island within the context of the Four Mountains in the Aleutian Island chain?,"['They are called the Islands of the Four Mountains. Part of the Aleutian Island chain, these peaks are actually the upper slopes of\n\nvolcanoes rising from the seafloor: Carlisle, Cleveland, Herbert, and Tana. Standing in one of the most remote reaches of the world,\n\nthese volcanoes have scarcely been studied. Satellite sensing makes that easier, as this Landsat 8 image from June 2013 shows.\n\nHerbert Island (right) is dominated by a symmetrical stratovolcano that stands in its center. The remote island has scarcely been\n\nstudied, and there are no records of eruptions there. The 2-kilometer-wide summit caldera include a lake of meltwater, remnants of\n\nthe snow that covers the peak for most of the year. The straight-down (nadir) satellite view can make it difficult to determine which\n\npart of the landscape stands taller than the other, a phenomenon known as relief inversion.\n\nOn the next page, you can see how a layer of low clouds and fog obscures the lower elevations of the islands and the sea surface.\n\nBut these clouds also hint at the complicated airflow patterns around and through the islands.\n\nE R E H P S O M T A\n\n28']","Herbert Island is one of the Four Mountains in the Aleutian Island chain, characterized by a symmetrical stratovolcano that dominates its center. This remote island has been scarcely studied, and there are no records of eruptions. The summit caldera, which is 2 kilometers wide, contains a lake of meltwater, remnants of the snow that covers the peak for most of the year. The island's landscape is affected by a phenomenon known as relief inversion, making it challenging to determine elevation differences from a straight-down satellite view. Additionally, a layer of low clouds and fog often obscures the lower elevations, indicating complex airflow patterns around and through the islands.",single_hop_specifc_query_synthesizer
"How has NASA's unique vantage point from space contributed to our understanding of Earth as a dynamic system, and what historical milestones mark its journey in observing our planet?","['This book stands at an intersection of science and art. From\n\nits origins, NASA has studied our planet in novel ways, using\n\ningenious tools to study physical processes at work—from\n\nbeneath the crust to the edge of the atmosphere. We look at it\n\nin macrocosm and microcosm, from the flow of one mountain\n\nstream to the flow of jet streams. Most of all, we look at Earth\n\nas a system, examining the cycles and processes—the water\n\ncycle, the carbon cycle, ocean circulation, the movement of\n\nheat—that interact and influence each other in a complex,\n\ndynamic dance across seasons and decades.\n\nWe measure particles, gases, energy, and fluids moving in, on,\n\nand around Earth. And like artists, we study the light—how it\n\nbounces, reflects, refracts, and gets absorbed and changed.\n\nUnderstanding the light and the pictures it composes is no\n\nsmall feat, given the rivers of air and gas moving between our\n\nsatellite eyes and the planet below.\n\nFor all of the dynamism and detail we can observe from orbit,\n\nsometimes it is worth stepping back and simply admiring Earth.\n\nIt is a beautiful, awe-inspiring place, and it is the only world\n\nmost of us will ever know.\n\nNASA has a unique vantage point for observing the beauty and\n\nwonder of Earth and for making sense of it. Looking back from\n\nspace, astronaut Edgar Mitchell once called Earth “a sparkling\n\nblue and white jewel,” and it does dazzle the eye. The planet’s\n\npalette of colors and textures and shapes—far more than just\n\nblues and whites—are spread across the pages of this book.\n\nWe chose these images because they inspire. They tell a story\n\nof a 4.5-billion-year-old planet where there is always something\n\nnew to see. They tell a story of land, wind, water, ice, and air\n\nas they can only be viewed from above. They show us that no\n\nmatter what the human mind can imagine, no matter what the\n\nartist can conceive, there are few things more fantastic and\n\ninspiring than the world as it already is. The truth of our planet\n\nis just as compelling as any fiction.\n\nWe hope you enjoy this satellite view of Earth.\n\nIt is your planet. It is NASA’s mission.\n\nMichael Carlowicz', 'Foreword\n\nof all celestial bodies within reach or view, as far as we can\n\nsee, out to the edge, the most wonderful and marvelous and\n\nmysterious is turning out to be our own planet earth. There is\n\nnothing to match it anywhere, not yet anyway.\n\n—Lewis Thomas\n\nSixty years ago, with the launch of Explorer 1, NASA made\n\nits first observations of Earth from space. Fifty years ago,\n\nastronauts left Earth orbit for the first time and looked back\n\nat our “blue marble.” All of these years later, as we send\n\nspacecraft and point our telescopes past the outer edges of\n\nthe solar system, as we study our planetary neighbors and\n\nour Sun in exquisite detail, there remains much to see and\n\nexplore at home.\n\nd R o w e R o F\n\nWe are still just getting to know Earth through the tools of\n\nscience. For centuries, painters, poets, philosophers, and\n\nphotographers have sought to teach us something about our\n\nhome through their art.\n\nvi']","NASA's unique vantage point from space has allowed for a comprehensive understanding of Earth as a dynamic system by enabling the observation of various physical processes, such as the water cycle, carbon cycle, and ocean circulation. This perspective helps in examining the interactions and influences among these cycles over time. Historical milestones in NASA's journey include the launch of Explorer 1, which marked the beginning of Earth's observations from space, and the moment astronauts first looked back at Earth, describing it as a 'blue marble.' These events highlight NASA's ongoing mission to explore and understand our planet, showcasing its beauty and complexity.",multi_hop_specific_query_synthesizer
"What unique perspectives does NASA provide in studying Earth, and how has its exploration evolved since the launch of Explorer 1?","['This book stands at an intersection of science and art. From\n\nits origins, NASA has studied our planet in novel ways, using\n\ningenious tools to study physical processes at work—from\n\nbeneath the crust to the edge of the atmosphere. We look at it\n\nin macrocosm and microcosm, from the flow of one mountain\n\nstream to the flow of jet streams. Most of all, we look at Earth\n\nas a system, examining the cycles and processes—the water\n\ncycle, the carbon cycle, ocean circulation, the movement of\n\nheat—that interact and influence each other in a complex,\n\ndynamic dance across seasons and decades.\n\nWe measure particles, gases, energy, and fluids moving in, on,\n\nand around Earth. And like artists, we study the light—how it\n\nbounces, reflects, refracts, and gets absorbed and changed.\n\nUnderstanding the light and the pictures it composes is no\n\nsmall feat, given the rivers of air and gas moving between our\n\nsatellite eyes and the planet below.\n\nFor all of the dynamism and detail we can observe from orbit,\n\nsometimes it is worth stepping back and simply admiring Earth.\n\nIt is a beautiful, awe-inspiring place, and it is the only world\n\nmost of us will ever know.\n\nNASA has a unique vantage point for observing the beauty and\n\nwonder of Earth and for making sense of it. Looking back from\n\nspace, astronaut Edgar Mitchell once called Earth “a sparkling\n\nblue and white jewel,” and it does dazzle the eye. The planet’s\n\npalette of colors and textures and shapes—far more than just\n\nblues and whites—are spread across the pages of this book.\n\nWe chose these images because they inspire. They tell a story\n\nof a 4.5-billion-year-old planet where there is always something\n\nnew to see. They tell a story of land, wind, water, ice, and air\n\nas they can only be viewed from above. They show us that no\n\nmatter what the human mind can imagine, no matter what the\n\nartist can conceive, there are few things more fantastic and\n\ninspiring than the world as it already is. The truth of our planet\n\nis just as compelling as any fiction.\n\nWe hope you enjoy this satellite view of Earth.\n\nIt is your planet. It is NASA’s mission.\n\nMichael Carlowicz', 'Foreword\n\nof all celestial bodies within reach or view, as far as we can\n\nsee, out to the edge, the most wonderful and marvelous and\n\nmysterious is turning out to be our own planet earth. There is\n\nnothing to match it anywhere, not yet anyway.\n\n—Lewis Thomas\n\nSixty years ago, with the launch of Explorer 1, NASA made\n\nits first observations of Earth from space. Fifty years ago,\n\nastronauts left Earth orbit for the first time and looked back\n\nat our “blue marble.” All of these years later, as we send\n\nspacecraft and point our telescopes past the outer edges of\n\nthe solar system, as we study our planetary neighbors and\n\nour Sun in exquisite detail, there remains much to see and\n\nexplore at home.\n\nd R o w e R o F\n\nWe are still just getting to know Earth through the tools of\n\nscience. For centuries, painters, poets, philosophers, and\n\nphotographers have sought to teach us something about our\n\nhome through their art.\n\nvi']","NASA provides a unique vantage point for observing Earth, allowing for the study of physical processes from beneath the crust to the edge of the atmosphere. This includes examining cycles such as the water cycle and carbon cycle, and understanding the movement of particles, gases, and energy. Since the launch of Explorer 1 sixty years ago, NASA has made significant advancements in observing Earth from space, evolving from initial observations to a comprehensive understanding of our planet's dynamics. Astronauts have also contributed to this exploration by looking back at Earth, famously describing it as a 'blue marble,' highlighting the beauty and complexity of our home planet.",multi_hop_specific_query_synthesizer
How does the Aqua satellite contribute to our understanding of cloud formation in relation to volcanic eruptions and wind patterns in the Amazon rainforest?,"['A Trio of Plumes South Atlantic Ocean\n\nThe uninhabited South Sandwich Islands include several active stratovolcanoes. Due to their remote location, these volcanoes\n\nare some of the least studied in the world, though satellites often catch them erupting.\n\nThe combination of clouds and ice at these latitudes can make it difficult to see plumes of volcanic ash in natural-color imagery.\n\nBut using portions of the electromagnetic spectrum that are typically invisible to the naked eye (such as infrared) enables satellites\n\nto distinguish ice from ash and clouds. The Aqua satellite captured this false-color image in September 2016. Note the three bright\n\nwhite plumes running down the middle third of the page; they are warmer and brighter in infrared than the cooler ice clouds (teal)\n\naround them.\n\nResearchers have learned that even small eruptions like this can affect cloud cover and weather. The tiny solid and liquid particles\n\nin the plume (aerosols) act as seeds for the formation of cloud droplets.\n\nE R E H P S O M T A\n\n6', 'Curving Cloud Streets Brazil and Bolivia\n\nTo the human eye, the wind is invisible. It can only be visualized by proxy, by its expressions in other phenomena like blowing leaves,\n\nairborne dust, white-capped waters—or the patterns of clouds.\n\nAcquired in June 2014 by the Aqua satellite, this image shows a broad swath of the Amazon rainforest in Brazil and Bolivia as it\n\nappeared in the early afternoon. As sunlight warms the forest in the morning, water vapor rises on columns of heated air. When that\n\nhumid air runs into a cooler, more stable air mass above, it condenses into fluffy cumulus clouds.\n\nCumulus cloud streets often trace the direction, and sometimes the intensity, of winds—lining up parallel to the direction of the wind.\n\nUsually this means a straight line, but clouds can also line up along the concentric, curved lines of high-pressure weather systems,\n\nas they did here.\n\nE R E H P S O M T A\n\n4']","The Aqua satellite plays a crucial role in understanding cloud formation by capturing images that reveal the effects of volcanic eruptions and wind patterns. For instance, it captured a false-color image of the South Sandwich Islands, showing how even small volcanic eruptions can release aerosols that act as seeds for cloud droplets, thereby affecting cloud cover and weather. Additionally, the Aqua satellite provided imagery of the Amazon rainforest, illustrating how rising water vapor from heated air condenses into cumulus clouds, which align with wind patterns. Together, these observations highlight the interplay between volcanic activity and atmospheric phenomena in cloud formation.",multi_hop_specific_query_synthesizer
How does the Aqua satelite help in understanding the effects of volcanic eruptions on cloud formation?,"['A Trio of Plumes South Atlantic Ocean\n\nThe uninhabited South Sandwich Islands include several active stratovolcanoes. Due to their remote location, these volcanoes\n\nare some of the least studied in the world, though satellites often catch them erupting.\n\nThe combination of clouds and ice at these latitudes can make it difficult to see plumes of volcanic ash in natural-color imagery.\n\nBut using portions of the electromagnetic spectrum that are typically invisible to the naked eye (such as infrared) enables satellites\n\nto distinguish ice from ash and clouds. The Aqua satellite captured this false-color image in September 2016. Note the three bright\n\nwhite plumes running down the middle third of the page; they are warmer and brighter in infrared than the cooler ice clouds (teal)\n\naround them.\n\nResearchers have learned that even small eruptions like this can affect cloud cover and weather. The tiny solid and liquid particles\n\nin the plume (aerosols) act as seeds for the formation of cloud droplets.\n\nE R E H P S O M T A\n\n6', 'Curving Cloud Streets Brazil and Bolivia\n\nTo the human eye, the wind is invisible. It can only be visualized by proxy, by its expressions in other phenomena like blowing leaves,\n\nairborne dust, white-capped waters—or the patterns of clouds.\n\nAcquired in June 2014 by the Aqua satellite, this image shows a broad swath of the Amazon rainforest in Brazil and Bolivia as it\n\nappeared in the early afternoon. As sunlight warms the forest in the morning, water vapor rises on columns of heated air. When that\n\nhumid air runs into a cooler, more stable air mass above, it condenses into fluffy cumulus clouds.\n\nCumulus cloud streets often trace the direction, and sometimes the intensity, of winds—lining up parallel to the direction of the wind.\n\nUsually this means a straight line, but clouds can also line up along the concentric, curved lines of high-pressure weather systems,\n\nas they did here.\n\nE R E H P S O M T A\n\n4']","The Aqua satellite helps in understanding the effects of volcanic eruptions on cloud formation by capturing images that distinguish between ice, ash, and clouds using infrared portions of the electromagnetic spectrum. For instance, it captured a false-color image of the South Sandwich Islands, showing plumes of volcanic ash that can affect cloud cover and weather by acting as seeds for the formation of cloud droplets.",multi_hop_specific_query_synthesizer
What atmospheric phenomena were observed in August 2016 related to the storms near Hawaii and the wave structures off Mauritania?,"['Double Trouble Pacific Ocean\n\nThe island of Hawaii rarely takes a direct hit from a hurricane. In August 2016, two Pacific storms almost changed that.\n\nThe Suomi NPP satellite observed Hurricanes Madeline and Lester stirring up the central Pacific Ocean as category 3 and 4 storms\n\nwhile moving northwest toward the Hawaiian Islands. The tight, deep eye of category 3 Hurricane Madeline (right) appears almost\n\nthree-dimensional even in a two-dimensional satellite view. Lester (next page) showed off an equally menacing eye. The bright\n\nstreaks across the ocean surface are areas of sunglint, where sunlight reflected directly back at the image.\n\nUltimately, the storms blew just south and north of the islands without making landfall. In fact, no hurricane has made landfall on the\n\nBig Island since recordkeeping started in 1949. Only 15 hurricanes have passed within 200 nautical miles of the island in that time.\n\nE R E H P S O M T A\n\n20', 'Riding the Waves Mauritania\n\nYou cannot see it directly, but air masses from Africa and the Atlantic Ocean are colliding in this Landsat 8 image from August 2016.\n\nThe collision off the coast of Mauritania produces a wave structure in the atmosphere.\n\nCalled an undular bore or solitary wave, this cloud formation was created by the interaction between cool, dry air coming off the\n\ncontinent and running into warm, moist air over the ocean. The winds blowing out from the land push a wave of air ahead like a\n\nbow wave moving ahead of a boat.\n\nParts of these waves are favorable for cloud formation, while other parts are not. The dust blowing out from Africa appears to be\n\nriding these waves. Dust has been known to affect cloud growth, but it probably has little to do with the cloud pattern observed here.\n\nE R E H P S O M T A\n\n16']","In August 2016, two Pacific storms, Hurricanes Madeline and Lester, were observed near Hawaii, stirring up the central Pacific Ocean as category 3 and 4 storms. Although they did not make landfall, they were significant atmospheric phenomena. Simultaneously, off the coast of Mauritania, air masses from Africa and the Atlantic Ocean collided, creating a wave structure in the atmosphere known as an undular bore or solitary wave. This interaction involved cool, dry air from the continent meeting warm, moist air over the ocean, influencing cloud formation.",multi_hop_specific_query_synthesizer
